{
  "id": "hermetica",
  "title": "Hermetica",
  "description": {
    "en": "The Hermetica is a collection of texts attributed to Hermes Trismegistus, a legendary figure who represents a syncretic combination of the Greek god Hermes and the Egyptian god Thoth. These texts, stemming from the Hellenistic period, are foundational to the tradition of Hermeticism, which blends elements of mysticism, astrology, alchemy, and philosophy. The Hermetica encompasses a wide range of writings, varying in style and content, but generally focused on esoteric wisdom, the nature of the divine, and the path to spiritual enlightenment.\n\nThe origins of these texts can be traced back to the early centuries of the Common Era, reflecting the cultural and philosophical fusion characteristic of the Hellenistic world. The figure of Hermes Trismegistus, often depicted as a wise sage or magician, serves as a symbolic mediator between the human and the divine, imparting secret knowledge and mystical insights. The Hermetic texts cover topics such as the creation of the universe, the nature of God, the human soul's immortality, and the process of achieving spiritual rebirth through the pursuit of Gnosis (knowledge).\n\n\"The Hermetica\" has had a profound impact on Western esoteric traditions, influencing Renaissance thinkers, who revered these texts as ancient wisdom, and continuing to inspire modern spiritual and occult movements. The Hermetic corpus is not a unified work but rather a collection of disparate texts, including the famous \"Emerald Tablet,\" known for its cryptic sayings, and the \"Corpus Hermeticum,\" a series of philosophical dialogues. Despite their varied nature, these writings collectively represent a significant and influential strand of mystical thought in the Western intellectual tradition.\n\n### Corpus of texts\n\n\"The Hermetica\" consists of a diverse collection of texts, each contributing to the rich tapestry of Hermetic wisdom. Among the most significant are the \"Corpus Hermeticum,\" the \"Emerald Tablet,\" and various other philosophical, astrological, and alchemical writings.\n\n- **Corpus Hermeticum:** This is perhaps the most well-known collection within \"The Hermetica.\" It comprises a series of 17 Greek treatises written from the 2nd to the 3rd century CE. These texts are primarily dialogues, where Hermes Trismegistus imparts wisdom on spiritual and philosophical matters to his disciples. The dialogues delve into themes such as the nature of the divine, the cosmos, the human soul, and the pursuit of Gnosis. The treatises blend Platonic and Stoic philosophies with Egyptian religious concepts, offering a unique window into the syncretic spiritual thought of the time.\n\n- **Emerald Tablet:** The Emerald Tablet, or Tabula Smaragdina, is a short, cryptic text attributed to Hermes Trismegistus and is famed for the phrase \"As above, so below.\" It summarizes the concept of macrocosm and microcosm and is foundational to Western alchemical tradition. Its exact origins are uncertain, but it is thought to have been written between the 6th and 8th centuries CE and was highly influential during the Renaissance.\n\n- **Astrological and Alchemical Writings:** Beyond philosophical texts, \"The Hermetica\" includes a wealth of astrological and alchemical literature. These texts explore the relationship between celestial bodies and terrestrial life, the process of transmuting base metals into gold (both literally and as a spiritual metaphor), and the idea of obtaining an elixir of immortality.\n\n- **Asclepius and Other Dialogues:** \"Asclepius,\" another important Hermetic text, is a dialogue that discusses the power of the mind and the creation of the world. Additionally, there are numerous lesser-known Hermetic dialogues and treatises that touch upon similar themes of cosmology, divinity, and esoteric wisdom.\n\nWhile the original texts of \"The Hermetica\" were likely written in Greek and Egyptian, they were later translated into Latin and other European languages, particularly during the Renaissance. The revival of interest in these texts during this period was instrumental in shaping the philosophical and scientific paradigms of the time. Today, \"The Hermetica\" continues to be an important resource for those interested in esoteric traditions, mysticism, and the history of Western occultism.\n\n### External links\n\n- [Translation of the Corpus Hermeticum | The Gnostic Society Library](http://www.gnosis.org/library/hermet.htm#CH)\n- [Translation of the Asclepius | The Gnostic Society Library](http://www.gnosis.org/library/grs-mead/TGH-v2/th237.html)\n- [Translation of  the Stobaean excerpts | The Gnostic Society Library](http://www.gnosis.org/library/grs-mead/TGH-v3/index.html)\n- [Translation of some ancient testimonies on Hermes | The Gnostic Society Library](http://www.gnosis.org/library/grs-mead/TGH-v2/th237.html)"
  },
  "authored_by": [
    "Hermes Trismegistus?"
  ],
  "topics": [
    "Esoterica",
    "Mysticism",
    "The Tradition"
  ],
  "stance": "neutral",
  "source_type": "myth_text",
  "publish_date": "200BC?",
  "source_family": "western_esoteric",
  "relation_to_wheel": "comparative_primary",
  "licensing_status": "public_domain",
  "follow_url": "http://www.gnosis.org/library/hermet.htm#CH",
  "aliases": [
    "/resources/hermetica/"
  ]
}
