{
  "id": "marriage-of-heaven-and-hell",
  "title": "The Marriage of Heaven and Hell",
  "description": {
    "en": "William Blake's 1790 prophetic work, source of the famous reading that Milton was 'of the Devil's party without knowing it.' Blake's inversion of conventional moral valuations — treating energy and rebellion as creative goods — is a principal Romantic antecedent of the corpus's non-orthodox reading of Lucifer."
  },
  "authored_by": [
    "William Blake"
  ],
  "topics": [
    "Lucifer",
    "Romanticism",
    "English Literature",
    "Devil"
  ],
  "stance": "neutral",
  "source_type": "fiction",
  "publish_date": "1790",
  "source_family": "western_esoteric",
  "relation_to_wheel": "scholarly_context",
  "licensing_status": "public_domain",
  "follow_url": "https://www.gutenberg.org/ebooks/45315"
}
