{
  "id": "the-techno-optimist-manifesto",
  "title": "The Techno-Optimist Manifesto",
  "description": {
    "en": "The Techno-Optimist Manifesto presents a vision of a future where technology is the driving force behind societal progress and human well-being. It challenges the pervasive narrative that technology causes harm, such as job loss, environmental degradation, and societal ills, arguing instead that technology has been, and should continue to be, a source of human advancement and achievement.\n\nCentral to the manifesto is the belief that societies, like sharks, must continue to grow or face decline. Growth, according to the manifesto, leads to vitality, expansion of life, increased knowledge, and higher well-being. The Techno-Optimists argue that economic growth is essential, and that stagnation leads to negative outcomes like zero-sum thinking, internal conflict, and societal collapse.\n\nThe manifesto identifies three sources of growth: population growth, natural resource utilization, and technology. With the first two facing limitations due to demographic trends and environmental constraints, technology is seen as the primary, sustainable driver of future growth. Techno-Optimists view technology as a lever on the world, allowing for more to be achieved with less, and as the main source of growth throughout history.\n\nThe Techno-Optimist Manifesto calls for a renewed embrace of technology, urging society to recognize its potential to build a better world. It advocates for a shift in perspective, from pessimism and fear about technological change to optimism and excitement about the possibilities it offers. The manifesto serves as a rallying cry for those who believe in the power of technology to transform society for the better, promoting a vision of a future where technology enhances human capabilities and leads to a more prosperous and equitable world.\n\n### About Marc Andreessen\n\nMarc Andreessen is a prominent American entrepreneur, investor, and software engineer, renowned for his influential role in shaping the modern internet landscape. Born on July 9, 1971, in Cedar Falls, Iowa, Andreessen co-authored Mosaic, the first widely-used web browser, while he was a student at the University of Illinois at Urbana-Champaign. This groundbreaking innovation laid the foundation for the development of Netscape Navigator, which he co-founded in 1994. Netscape's success not only heralded the internet era but also positioned Andreessen as a key figure in the dot-com boom of the late 1990s. After Netscape was acquired by AOL, he continued to contribute to the tech industry as an entrepreneur and investor. In 2009, Andreessen co-founded Andreessen Horowitz, a private venture capital firm, which has invested in several successful startups, including Facebook, Twitter, and Airbnb. Known for his forward-thinking views on technology and its potential to drive societal progress, Andreessen remains a significant and influential voice in Silicon Valley.\n\n### See more\n\n- [Wiki › Cyberparadism](/wiki/encyclopedia/cyberparadism/)\n- [Resources › Cyberparadism Manifesto](/resources/cyberparadism-manifesto/)\n\n### External links\n\n- [The Techno-Optimist Manifesto](https://a16z.com/the-techno-optimist-manifesto/)"
  },
  "authored_by": [
    "Marc Andreessen"
  ],
  "topics": [
    "Age of Aquarius",
    "Cyberparadism",
    "Futurism"
  ],
  "stance": "neutral",
  "source_type": "official_document",
  "draft": true,
  "publish_date": "2023",
  "source_family": "supplementary",
  "relation_to_wheel": "supplementary",
  "licensing_status": "unknown",
  "follow_url": "https://a16z.com/the-techno-optimist-manifesto/",
  "aliases": [
    "/resources/the-techno-optimist-manifesto/"
  ]
}
