{
  "id": "meyers-discovering-eve",
  "title": "Discovering Eve: Ancient Israelite Women in Context",
  "description": {
    "en": "Carol Meyers's 1988 Oxford University Press historical-anthropological study reading Eve as representing the agricultural-laboring woman of Iron Age Israel, reframing the Genesis 3:16 'curses' as descriptive of difficult social conditions rather than prescriptive gender hierarchy."
  },
  "authored_by": [
    "Carol Meyers"
  ],
  "topics": [
    "Eve",
    "Adam and Eve",
    "Israelite Society",
    "Feminist Scholarship"
  ],
  "stance": "neutral",
  "source_type": "academic_monograph",
  "publish_date": "1988",
  "source_family": "criticism",
  "relation_to_wheel": "scholarly_context",
  "licensing_status": "licensed",
  "follow_url": "https://global.oup.com/academic/product/discovering-eve-9780195049343"
}
