{
  "id": "the-revelation-of-the-pyramid",
  "title": "The Revelation of the Pyramids",
  "description": {
    "en": "\"The Revelation of the Pyramids,\" a French documentary directed by Patrice Pooyard and released in 2010, delves into pseudo-historical theories proposed by Jacques Grimault. Grimault's unpublished works suggest a slow cycle of geological changes on Earth, including shifts in magnetic poles, causing catastrophic events every 26,000 years. He theorizes that an ancient civilization, predating ours, was destroyed by these catastrophes, and that they built the Pyramids of Giza and other ancient structures. These structures, he claims, were not primarily tombs but mathematical riddles, warning of this cyclical disaster.\n\nThe film also claims that the Giza pyramid complex and other archaeological sites like Easter Island and Machu Picchu are aligned on a \"leaning equator,\" positioned equidistant from the Earth's magnetic poles. This alignment is theorized to be part of a larger framework that views pyramids as energy generators.\n\n### See also\n\n- [Wiki › Ancient Builders](/wiki/encyclopedia/ancient-builders/)\n- [Wiki › Sacred Geometry](/wiki/encyclopedia/sacred-geometry/)\n\n### External links\n\n- [The Revelations of the Pyramids | Wikipedia](https://en.wikipedia.org/wiki/The_Revelation_of_the_Pyramids)"
  },
  "original_title": "La Révélation des Pyramides",
  "authored_by": [
    "Jacques Grimault",
    "Patrice Pooyard"
  ],
  "topics": [
    "Age of Aquarius",
    "Ancient Builders",
    "Astrological ages",
    "Cataclysm",
    "Precession",
    "Pyramids",
    "The Tradition"
  ],
  "stance": "neutral",
  "source_type": "documentary",
  "publish_date": "2010",
  "source_family": "supplementary",
  "relation_to_wheel": "supplementary",
  "licensing_status": "unknown",
  "follow_url": "https://www.imdb.com/title/tt2124189/",
  "aliases": [
    "/resources/the-revelation-of-the-pyramid/"
  ]
}
