{
  "id": "cosmic-serpent-narby",
  "title": "The Cosmic Serpent: DNA and the Origins of Knowledge",
  "description": {
    "en": "Jeremy Narby's 1998 work proposing that cross-cultural intertwined-serpent imagery (the caduceus, Ningishzida's staff) encodes ancestral knowledge of the DNA double helix. The corpus registers the DNA-iconography hypothesis as suggestive but not load-bearing for its reading of the Eden Serpent."
  },
  "authored_by": [
    "Jeremy Narby"
  ],
  "topics": [
    "Serpent",
    "DNA",
    "Shamanism",
    "Iconography"
  ],
  "stance": "neutral",
  "source_type": "academic_monograph",
  "publish_date": "1998",
  "source_family": "neo_euhemerism",
  "relation_to_wheel": "supplementary",
  "licensing_status": "licensed",
  "follow_url": "https://www.penguinrandomhouse.com/books/330425/the-cosmic-serpent-by-jeremy-narby/"
}
