{
  "id": "pagels-gnostic-gospels",
  "title": "The Gnostic Gospels",
  "description": {
    "en": "Elaine Pagels's 1979 Random House study of the Nag Hammadi Gnostic texts and their suppressed alternative Christianities, including the Ophite and Sethian readings that reversed the valuation of the Eden Serpent. The principal accessible scholarly entry to the Gnostic material the corpus engages on the Serpent."
  },
  "authored_by": [
    "Elaine Pagels"
  ],
  "topics": [
    "Gnosticism",
    "Serpent",
    "Nag Hammadi",
    "Early Christianity"
  ],
  "stance": "neutral",
  "source_type": "academic_monograph",
  "publish_date": "1979",
  "source_family": "criticism",
  "relation_to_wheel": "scholarly_context",
  "licensing_status": "licensed",
  "follow_url": "https://www.penguinrandomhouse.com/books/167762/the-gnostic-gospels-by-elaine-pagels/"
}
