{
  "id": "plaskow-standing-again-sinai",
  "title": "Standing Again at Sinai: Judaism from a Feminist Perspective",
  "description": {
    "en": "Judith Plaskow's 1990 Harper work, a foundational Jewish feminist theology engaging the Adam-Eve and Lilith traditions. Includes the reclamation of Lilith as a symbol of feminine autonomy that the corpus registers as a substantive cultural development."
  },
  "authored_by": [
    "Judith Plaskow"
  ],
  "topics": [
    "Lilith",
    "Feminist Theology",
    "Judaism",
    "Adam and Eve"
  ],
  "stance": "neutral",
  "source_type": "academic_monograph",
  "publish_date": "1990",
  "source_family": "criticism",
  "relation_to_wheel": "scholarly_context",
  "licensing_status": "licensed",
  "follow_url": "https://www.harpercollins.com/"
}
