{
  "id": "natufian-culture-in-the-levant",
  "title": "The Natufian Culture in the Levant",
  "description": {
    "en": "Ofer Bar-Yosef and François R. Valla's 1991 edited volume (International Monographs in Prehistory) is the standard scholarly treatment of the Natufian culture — the late Epipalaeolithic Levantine complex (c. 13,000–9700 BCE) that immediately precedes the Pre-Pottery Neolithic and the Göbekli Tepe horizon. The Natufian is the principal archaeological context for the emergence of sedentism, intensive plant gathering, and the social conditions that produced the subsequent Neolithic transition. The volume remains the foundational comparative source for engaging the broader regional context within which Göbekli Tepe sits."
  },
  "authored_by": [
    "Ofer Bar-Yosef",
    "François R. Valla"
  ],
  "topics": [
    "Natufian",
    "Pre-Pottery Neolithic",
    "Levantine Archaeology",
    "Antediluvian"
  ],
  "stance": "neutral",
  "source_type": "academic_monograph",
  "publish_date": "1991",
  "source_family": "archaeoastronomy",
  "relation_to_wheel": "scientific_context",
  "licensing_status": "licensed",
  "follow_url": "https://www.amazon.com/Natufian-Culture-Levant-International-Monographs/dp/187962101X"
}
