{
  "id": "sandt-zangenberg-matthew-james-didache",
  "title": "Matthew, James, and Didache: Three Related Documents in Their Jewish and Christian Settings",
  "description": {
    "en": "Huub van de Sandt and Jürgen Zangenberg's 2008 Society of Biblical Literature volume on the Jewish-Christian milieu of the early Jesus movement — scholarly context for the corpus's reading of the prophetic-return material around the embassy."
  },
  "authored_by": [
    "Huub van de Sandt",
    "Jürgen K. Zangenberg"
  ],
  "topics": [
    "Early Christianity",
    "Didache",
    "Jewish Christianity",
    "Eschatology"
  ],
  "stance": "neutral",
  "source_type": "academic_monograph",
  "publish_date": "2008",
  "source_family": "abrahamic",
  "relation_to_wheel": "scholarly_context",
  "licensing_status": "licensed",
  "follow_url": "https://www.sbl-site.org/"
}
